{
  "schema": "flowxo.contract-lock.v1",
  "schema_sha256": "6b756359081039710b7a3a9f0c88ad1de033480252096fa35af529a20c00f73f",
  "policy_sha256": "555cdfd33ef52c796928d04404b71f1d0c2567af593f1ba024a40b3949eb54e1",
  "repository": "flowxo/agent-relay",
  "dependencies": [
    {
      "owner": "whooshbang",
      "artifact": "@whooshbang/contracts",
      "version": "1.0.0-rc.10",
      "source_repository": "flowxo/whooshbang",
      "source_commit": "08d4203fc2f52c4ab80fcfbc6416951351fba8ae",
      "sha256": "2253e94e1d78092bb605b2c16c453a6526b173e6753f36f1446a1527b4bc98cb",
      "artifact_file": "vendor/whooshbang-rc10-rc11-rc13/whooshbang-contracts-1.0.0-rc.10.tgz",
      "fixture_sets": [
        {
          "id": "core-api-bodies",
          "version": "1.0.0-rc.10"
        },
        {
          "id": "core-semantic-scenarios",
          "version": "1.0.0-rc.10"
        },
        {
          "id": "interaction-message-api-bodies",
          "version": "1.0.0-rc.10"
        },
        {
          "id": "interaction-contract-bodies",
          "version": "1.0.0-rc.10"
        },
        {
          "id": "machine-api-bodies",
          "version": "1.0.0-rc.10"
        },
        {
          "id": "provider-capability-bodies",
          "version": "1.0.0-rc.10"
        },
        {
          "id": "interaction-machine-semantic-scenarios",
          "version": "1.0.0-rc.10"
        },
        {
          "id": "customer-event-bodies",
          "version": "1.0.0-rc.10"
        },
        {
          "id": "webhook-signing-vectors",
          "version": "1.0.0-rc.10"
        },
        {
          "id": "webhook-delivery-cases",
          "version": "1.0.0-rc.10"
        },
        {
          "id": "core-fixture-index",
          "version": "1.0.0-rc.10"
        }
      ]
    },
    {
      "owner": "whooshbang",
      "artifact": "@whooshbang/sdk",
      "version": "1.0.0-rc.11",
      "source_repository": "flowxo/whooshbang",
      "source_commit": "08d4203fc2f52c4ab80fcfbc6416951351fba8ae",
      "sha256": "8230ef4918b7d555be3688396882dfd9d1ba6b1b7b96ea72dd20f30a7e2be7e4",
      "artifact_file": "vendor/whooshbang-rc10-rc11-rc13/whooshbang-sdk-1.0.0-rc.11.tgz",
      "fixture_sets": []
    },
    {
      "owner": "whooshbang",
      "artifact": "@whooshbang/contract-mock",
      "version": "1.0.0-rc.13",
      "source_repository": "flowxo/whooshbang",
      "source_commit": "08d4203fc2f52c4ab80fcfbc6416951351fba8ae",
      "sha256": "56a612ea65c0b53c24677666ac3b7dc5f15af93f3092b4fa178e8dadd6b6ab56",
      "artifact_file": "vendor/whooshbang-rc10-rc11-rc13/whooshbang-contract-mock-1.0.0-rc.13.tgz",
      "fixture_sets": [
        {
          "id": "contract-mock-scenarios.v1",
          "version": "1.0.0-rc.9"
        }
      ]
    }
  ],
  "owned_artifacts": []
}
